{
  "protocol_version": 1,
  "event_id": "evt_output_1",
  "supervisor_id": "sup_walk_1",
  "sequence": 7,
  "occurred_at": "2026-08-31T12:00:00Z",
  "trace_id": "trace_execute_1",
  "layer": "execution",
  "operation": "execute",
  "kind": "execution.output",
  "resource": {
    "kind": "execution",
    "id": "exe_walk_1"
  },
  "payload": {
    "execution_id": "exe_walk_1",
    "client_id": "client_walk_1",
    "output_kind": "stdout",
    "media_type": "text/plain",
    "data": "\u001b[31mred\u001b[0m"
  }
}
