{
  "protocol_version": 1,
  "event_id": "evt_surface_created_1",
  "supervisor_id": "sup_fixture",
  "sequence": 10,
  "occurred_at": "2026-09-01T08:00:01Z",
  "trace_id": "trace_surface_create",
  "layer": "client",
  "operation": "execute",
  "kind": "surface.created",
  "resource": {"kind": "surface", "id": "surf_fixture"},
  "payload": {
    "surface_id": "surf_fixture",
    "client_id": "cli_fixture",
    "runtime_id": "run_fixture",
    "kind": "terminal",
    "capabilities": ["input", "resize", "signal"],
    "transport": {
      "kind": "websocket",
      "endpoint": "/v1/surfaces/surf_fixture/terminal",
      "subprotocol": "jusi.terminal.v1"
    },
    "created_at": "2026-09-01T08:00:01Z"
  }
}
