{
  "protocol_version": 1,
  "event_id": "evt_action",
  "supervisor_id": "sup_fixture",
  "sequence": 1,
  "occurred_at": "2026-09-09T00:00:00Z",
  "trace_id": "trace_id_fixture",
  "layer": "client",
  "operation": "attention",
  "kind": "client.attention_changed",
  "resource": {
    "kind": "client",
    "id": "client_id_fixture"
  },
  "payload": {
    "attention_id": "attn_fixture",
    "client_id": "client_id_fixture",
    "runtime_id": "runtime_id_fixture",
    "notebook_id": "notebook_id_fixture",
    "cell_id": "cell_id_fixture",
    "editor_id": "editor_id_fixture",
    "kind": "action_required",
    "message": "Approval requested",
    "revision": 1,
    "state": "pending"
  }
}
